,Eligibility,Name,Description,Link,Deadline
95,1,"Opportunity for USA Universities and Qualified Educational 
Institutions to Host a STEM Progr...",Opportunity for USA universities and other qualified educational institutions to host a STEM summer program for students. Programs provide mentoring and laboratory and research experience to eligible high school students. Host institutions will be responsible for progr...,https://texas.grantwatch.com//grant/193129/opportunity-for-usa-universities-and-qualified-educational-institutions-to-host-a-stem-program-for-high-school-students.html,"12/18/20
Conference Date: 11/24/20"
96,0,"Grants to USA Nonprofits, Schools, IHEs, and Agencies 
for Healthcare Education, Services, an...","Grants to USA nonprofits, public schools and IHEs, agencies, hospitals, and Indian tribal governments for programs that benefit the medical and scientific community, public health, and patients. Requests must be consistent with a technological or therapeutic area in wh...",https://texas.grantwatch.com//grant/164283/grants-to-usa-nonprofits-schools-ihes-and-agencies-for-healthcare-education-services-and-outreach.html,11/25/20
